Mã bưu cục,Bưu cục,Địa chỉ,lat,long,Quận,Bưu tá
116000,Bưu cục cấp 3 Kim Liên,"Dãy nhà B15, Khu tập thể Kim Liên, Phường Kim Liên, Quận Đống Đa",21.00741414,105.8351221,đống đa,20
120500,Bưu cục cấp 3 Thanh Xuân Bắc,"Dãy nhà C10, Khu tập thể Thanh Xuân Bắc, Phường Thanh Xuân Bắc, Quận Thanh Xuân",21.02314833,105.8140952,thanh xuân,18
118400,Bưu cục cấp 3 Giảng Võ,"Dãy nhà D2, Khu tập thể Giảng Võ, Phường Giảng Võ, Quận Ba Đình",21.02614366,105.8224256,ba đình,16
112200,Bưu cục cấp 3 Nguyễn Công Trứ,"Dãy nhà N8, Khu tập thể Nguyễn Công Trứ, Phường Phố Huế, Quận Hai Bà Trưng",21.01311787,105.8524946,hai bà trưng,11
123075,Bưu cục cấp 3 KHL EMS,"Sô´01, Đường Trung Kính, Phường Trung Hòa, Quận Cầu Giấy",21.01354812,105.8020459,cầu giấy,10
110307,Hòm thư Công cộng độc lập phố Hàng Đào,"Sô´1, Phố Hàng Đào, Phường Hàng Đào, Quận Hoàn Kiếm",21.03428913,105.8507735,hoàn kiếm,9
111413,Bưu cục văn phòng In báo Quân Đội,"Sô´1, Phố Lê Văn Linh, Phường Hàng Mã, Quận Hoàn Kiếm",21.0374703,105.8459816,hoàn kiếm,14
116177,Hòm thư Công cộng độc lập Trường Đại học Y,"Sô´1, Phố Tôn Thất Tùng, Phường Trung Tự, Quận Đống Đa",21.0059966,105.8312052,đống đa,16
101006,Bưu cục cấp 3 [EMS] Giao dịch Tân Xuân,"Sô´1, Đường Tân Xuân, Xã Xuân Đỉnh, Quận Nam Từ Liêm",21.07817613,105.7864158,nam từ liêm,10
110911,Hòm thư Công cộng độc lập phố Hàng Bạc,"Sô´101, Phố Hàng Bạc, Phường Hàng Bạc, Quận Hoàn Kiếm",21.03434347,105.8520504,hoàn kiếm,8
113100,Bưu cục cấp 3 Lò Đúc,"Sô´114, Phố Lò Đúc, Phường Đống Mác, Quận Hai Bà Trưng",21.01350925,105.8577827,hai bà trưng,5
129629,Điểm BĐVHX Bưu điện Xuân Phương,"Sô´129, Đường Phương Canh, Phường Xuân Phương, Quận Nam Từ Liêm",21.03468437,105.7468765,nam từ liêm,8
123105,Hòm thư Công cộng độc lập trường Đại học Quốc gia Hà Nội,"Sô´136, Đường Xuân Thủy, Phường Dịch Vọng Hậu, Quận Cầu Giấy",21.03685368,105.7843146,cầu giấy,13
118977,Hòm thư Công cộng độc lập - 14 Láng Hạ,"Sô´14, Phố Láng Hạ, Phường Thành Công, Quận Ba Đình",21.0197123,105.8166216,ba đình,20
129049,Bưu cục cấp 3 BC KHL Nam Từ Liêm 2,"Sô´14, Đường Nguyễn Cơ Thạch, Phường Cầu Diễn, Quận Nam Từ Liêm",21.03737591,105.7666771,nam từ liêm,11
111212,Đại lý bưu điện Phùng Hưng,"Sô´143, Phố Phùng Hưng, Phường Cửa Đông, Quận Hoàn Kiếm",21.03252612,105.8453375,hoàn kiếm,18
129000,Bưu cục cấp 2 Cầu Diễn 2,"Sô´149, Đường Hồ Tùng Mậu, Phường Cầu Diễn, Quận Nam Từ Liêm",21.04035513,105.7650008,nam từ liêm,14
118733,Bưu cục cấp 3 Giao dịch EMS Ba Đình 1,"Sô´152B, Phố Nguyễn Thái Học, Phường Điện Biên, Quận Ba Đình",21.03221728,105.8306531,ba đình,16
122000,Bưu cục cấp 2 Cầu Giấy,"Sô´165, Đường Cầu Giấy, Phường Quan Hoa, Quận Cầu Giấy",21.03264761,105.7983391,cầu giấy,5
111400,Bưu cục cấp 3 Hàng Cót,"Sô´16D, Phố Phùng Hưng, Phường Cửa Đông, Quận Hoàn Kiếm",21.03219444,105.8449999,hoàn kiếm,11
118030,Bưu cục cấp 3 Bưu cục Đại sứ quán Mỹ,"Sô´170, Phố Ngọc Khánh, Phường Ngọc Khánh, Quận Ba Đình",21.02473063,105.8188342,ba đình,20
130690,Bưu cục cấp 3 Xuân Phương,"Sô´171, Đường Xuân Phương, Phường Phương Canh, Quận Nam Từ Liêm",21.03597414,105.7383564,nam từ liêm,16
117130,Bưu cục cấp 3 [EMS] GD Thanh Xuân,"Sô´172, Đường Láng, Phường Thịnh Quang, Quận Đống Đa",21.00528174,105.81737,đống đa,13
112300,Bưu cục cấp 3 Chuyển Tiền,"Sô´18, Phố Nguyễn Du, Phường Bùi Thị Xuân, Quận Hai Bà Trưng",21.01863946,105.8507298,hai bà trưng,6
111300,Bưu cục cấp 3 Đồng Xuân,"Sô´18, Phố Đồng Xuân, Phường Đồng Xuân, Quận Hoàn Kiếm",21.03797029,105.8490644,hoàn kiếm,18
113900,Bưu cục cấp 3 Chợ Mơ,"Sô´185, Phố Minh Khai, Phường Trương Định, Quận Hai Bà Trưng",20.99537635,105.8572265,hai bà trưng,8
120700,Bưu cục cấp 3 Khương Mai,"Sô´185, Phố Nguyễn Ngọc Nại, Phường Khương Mai, Quận Thanh Xuân",20.99804539,105.8227997,thanh xuân,15
113713,Bưu cục cấp 3 Giao dịch EMS Hai Bà Trưng 1,"Sô´186, Phố Trần Khát Chân, Phường Thanh Nhàn, Quận Hai Bà Trưng",21.00885444,105.8641805,hai bà trưng,13
113068,Hòm thư Công cộng độc lập Trường Đại học KTQD,"Sô´187, Phố Trần Đại Nghĩa, Phường Đồng Tâm, Quận Hai Bà Trưng",20.99906884,105.8460781,hai bà trưng,15
115545,Bưu cục cấp 3 [EMS] Cát Linh,"Sô´19, Phố Cát Linh, Phường Cát Linh, Quận Đống Đa",21.02896928,105.830768,đống đa,13
110019,Bưu cục cấp 3 PHBC Postmart Lê Thạch,"Sô´2, Phố Lê Thạch, Phường Tràng Tiền, Quận Hoàn Kiếm",21.02712965,105.8540599,hoàn kiếm,14
112310,Bưu cục cấp 3 Vân Hồ,"Sô´2, Phố Vân Hồ 3, Phường Lê Đại Hành, Quận Hai Bà Trưng",21.01084626,105.8459106,hai bà trưng,18
120120,Bưu cục cấp 3 Khương Đình,"Sô´20, Đường Khương Đình, Phường Thượng Đình, Quận Thanh Xuân",20.99735282,105.8142316,thanh xuân,13
120065,Bưu cục cấp 3 Giao dịch EMS Thanh Xuân 2,"Sô´212, Đường Nguyễn Huy Tưởng, Phường Thanh Xuân Trung, Quận Thanh Xuân",20.99703935,105.8034723,thanh xuân,7
118000,Bưu cục cấp 3 Cống Vị,"Sô´218, Phố Đội Cấn, Phường Cống Vị, Quận Ba Đình",21.03790167,105.8090614,ba đình,13
111100,Bưu cục cấp 3 Cửa Nam,"Sô´22, Phố Cửa Nam, Phường Cửa Nam, Quận Hoàn Kiếm",21.02799153,105.8418634,hoàn kiếm,17
118518,Hòm thư Công cộng độc lập - 248 Kim Mã,"Sô´248, Phố Kim Mã, Phường Kim Mã, Quận Ba Đình",21.03198005,105.8236161,ba đình,19
111515,Hòm thư Công cộng độc lập phố Hàng Buồm,"Sô´28, Phố Mã Mây, Phường Hàng Buồm, Quận Hoàn Kiếm",21.03555325,105.8534485,hoàn kiếm,8
119511,Bưu cục cấp 3 Trung tâm dịch vụ Ba Đình,"Sô´281, Phố Đội Cấn, Phường Liễu Giai, Quận Ba Đình",21.03517878,105.8202341,ba đình,5
110201,Hòm thư Công cộng độc lập Thư viện Quốc gia,"Sô´31, Phố Tràng Thi, Phường Hàng Trống, Quận Hoàn Kiếm",21.02905807,105.8496358,hoàn kiếm,5
115000,Bưu cục cấp 2 Đống Đa,"Sô´35, Phố Thái Thịnh, Phường Thịnh Quang, Quận Đống Đa",21.00723615,105.8210928,đống đa,11
115356,Bưu cục cấp 3 Xã Đàn,"Sô´360/40, Phố Nam Đồng, Phường Nam Đồng, Quận Đống Đa",21.01381115,105.8333263,đống đa,19
122300,Bưu cục cấp 3 Hoàng Quốc Việt,"Sô´393, Đường Hoàng Quốc Việt, Phường Nghĩa Tân, Quận Cầu Giấy",21.04601007,105.791191,cầu giấy,6
100995,Bưu cục Phát hành Báo chí KT VCBC 2,"Sô´4, Phố Lê Văn Linh, Phường Hàng Mã, Quận Hoàn Kiếm",21.03762619,105.8465941,hoàn kiếm,7
110513,Hòm thư Công cộng độc lập phố Nguyễn Chế Nghĩa,"Sô´4, Phố Nguyễn Chế Nghĩa, Phường Hàng Bài, Quận Hoàn Kiếm",21.02043008,105.8528632,hoàn kiếm,6
118734,Bưu cục cấp 3 EMS Cục Xuất Nhập Cảnh,"Sô´44-46, Phố Trần Phú, Phường Điện Biên, Quận Ba Đình",21.03162354,105.8379452,ba đình,16
118028,Bưu cục cấp 3 Đốc Ngữ,"Sô´440, Phố Đội Cấn, Phường Cống Vị, Quận Ba Đình",21.03781757,105.8106133,ba đình,20
115070,Bưu cục cấp 3 [EMS] Đống Đa,"Sô´45 ngõ 9, Phố Hoàng Cầu, Phường Ô Chợ Dừa, Quận Đống Đa",21.01912626,105.8272622,đống đa,6
122913,Bưu cục cấp 3 Doãn Kế Thiện,"Sô´46, Đường Doãn Kế Thiện, Phường Mai Dịch, Quận Cầu Giấy",21.04189495,105.7762638,cầu giấy,7
116700,Bưu cục cấp 3 Đặng Tiến Đông,"Sô´47, Phố Đặng Tiến Đông, Phường Trung Liệt, Quận Đống Đa",21.01166882,105.8244196,đống đa,11
114001,Hòm thư Công cộng độc lập Bệnh viện Thanh Nhàn,"Sô´48, Phố Thanh Nhàn, Phường Thanh Nhàn, Quận Hai Bà Trưng",21.00312412,105.8527549,hai bà trưng,6
111000,Bưu cục cấp 3 Tháp Hà Nội,"Sô´49, Phố Hai Bà Trưng, Phường Trần Hưng Đạo, Quận Hoàn Kiếm",21.02643582,105.8455045,hoàn kiếm,16
118728,Bưu cục cấp 3 Nguyễn Thái Học,"Sô´49, Phố Nguyễn Thái Học, Phường Điện Biên, Quận Ba Đình",21.02915211,105.8406576,ba đình,13
130679,Bưu cục cấp 3 PHBC Postmart Phạm Hùng,"Sô´5, Thôn Phú Mỹ, Phường Mỹ Đình 2, Quận Nam Từ Liêm",21.03084838,105.7739875,nam từ liêm,12
130020,Bưu cục cấp 3 Đại Mỗ,"Sô´522, Tổ dân phố xóm Tháp, Phường Đại Mỗ, Quận Nam Từ Liêm",20.99576254,105.7532964,nam từ liêm,17
120987,Bưu cục cấp 3 KHL EMS TMĐT 1,"Sô´565, Đường Vũ Tông Phan, Phường Khương Trung, Quận Thanh Xuân",20.98477766,105.81525,thanh xuân,19
119197,Hòm thư Công cộng độc lập phố Nghĩa Dũng,"Sô´57, Phố Nghĩa Dũng, Phường Phúc Xá, Quận Ba Đình",21.04787844,105.8473463,ba đình,10
100100,Bưu cục cấp 3 Quốc Tế,"Sô´6, Phố Đinh Lễ, Phường Tràng Tiền, Quận Hoàn Kiếm",21.02627818,105.8535641,hoàn kiếm,12
110402,Hòm thư Công cộng độc lập Khách sạn Hilton Opera,"Sô´6, Phố Đặng Thái Thân, Phường Phan Chu Trinh, Quận Hoàn Kiếm",21.02311878,105.8582716,hoàn kiếm,19
110220,Bưu cục cấp 3 Lương Văn Can,"Sô´66, Phố Lương Văn Can, Phường Hàng Trống, Quận Hoàn Kiếm",21.03309467,105.8490702,hoàn kiếm,16
110000,Bưu cục cấp 2 Tràng Tiền,"Sô´66, Phố Tràng Tiền, Phường Tràng Tiền, Quận Hoàn Kiếm",21.02578733,105.853382,hoàn kiếm,15
112618,Bưu cục cấp 3 Giao dịch EMS Hai Bà Trưng 2,"Sô´67, Phố Ngô Thì Nhậm, Phường Ngô Thì Nhậm, Quận Hai Bà Trưng",21.0141319,105.8536426,hai bà trưng,10
112617,Hòm thư Công cộng độc lập Khách sạn Nikko,"Sô´68, Phố Trần Nhân Tông, Phường Nguyễn Du, Quận Hai Bà Trưng",21.01784742,105.8423565,hai bà trưng,18
117127,Bưu cục cấp 3 Lãnh sự quán Mỹ MB,"Sô´7, Phố Láng Hạ, Phường Láng Hạ, Quận Đống Đa",21.02218032,105.8187276,đống đa,17
119346,Bưu cục cấp 3 Giao dịch EMS Ba Đình 2,"Sô´70, Phố Đốc Ngữ, Phường Vĩnh Phúc, Quận Ba Đình",21.04045927,105.8129384,ba đình,14
111770,Bưu cục cấp 3 Bưu cục Giao dịch 5,"Sô´78, Đường Bạch Đằng, Phường Chương Dương Độ, Quận Hoàn Kiếm",21.0102273,105.8679702,hoàn kiếm,12
122772,Bưu cục cấp 3 Hoàng Sâm,"Sô´8, Phố Hoàng Sâm, Phường Nghĩa Đô, Quận Cầu Giấy",21.04581489,105.7995332,cầu giấy,12
118600,Bưu cục cấp 3 Quán Thánh,"Sô´8, Phố Quán Thánh, Phường Nguyễn Trung Trực, Quận Ba Đình",21.04046002,105.8470108,ba đình,10
115490,Bưu cục cấp 3 Hoàng Cầu,"Sô´9, Phố Hoàng Cầu, Phường Ô Chợ Dừa, Quận Đống Đa",21.01925427,105.8272787,đống đa,16
117000,Bưu cục cấp 3 Láng Trung,"Sô´95, Phố Nguyễn Chí Thanh, Phường Láng Hạ, Quận Đống Đa",21.01925353,105.8081429,đống đa,9
122080,Bưu cục cấp 3 Trung tâm dịch vụ Cầu Giấy,"Sô´CT4-5, Phố Dương Đình Nghệ, Phường Yên Hòa, Quận Cầu Giấy",21.02246419,105.7878923,cầu giấy,8
130658,Bưu cục cấp 3 EMS KHL Từ Liêm,"Sô´Ngõ 84, Đường Xuân Phương, Phường Phương Canh, Quận Nam Từ Liêm",21.03250106,105.7390944,nam từ liêm,15
122320,Bưu cục cấp 3 Nghĩa Tân,"Sô´P100, Dãy nhà A15, Khu tập thể Nghĩa Tân, Phường Nghĩa Tân, Quận Cầu Giấy",21.04492383,105.7944075,cầu giấy,8
112400,Bưu cục cấp 3 Bách Khoa,"Sô´P12-A17, Phố Tạ Quang Bửu, Phường Bách Khoa, Quận Hai Bà Trưng",21.00397069,105.8475064,hai bà trưng,13
123080,Bưu cục cấp 3 EMS Cầu Giấy,"Sô´T. N09,193, Đường Trung Kính, Phường Trung Hòa, Quận Cầu Giấy",21.01803779,105.7927856,cầu giấy,8
123071,Bưu cục cấp 3 EMS KHL Cầu Giấy,"Sô´Tòa N02, Ngõ 259, Phố Yên Hòa, Phường Yên Hòa, Quận Cầu Giấy",21.02024639,105.7932248,cầu giấy,18
118800,Bưu cục cấp 3 Thanh Niên,"Số 1, Phố Trấn Vũ, Phường Trúc Bạch, Quận Ba Đình",21.04445498,105.8382919,ba đình,9
129731,Điểm BĐVHX Bưu điện Minh Khai,"Thôn Ngoạ Long, Xã Minh Khai, Quận Nam Từ Liêm",21.05124142,105.7454222,nam từ liêm,12
130301,Điểm BĐVHX Trung Văn,"Thôn Trung Văn, Phường Trung Văn, Quận Nam Từ Liêm",20.99306736,105.7781855,nam từ liêm,11
130000,Điểm BĐVHX Đại Mỗ,"Tổ dân phố xóm Tháp, Phường Đại Mỗ, Quận Nam Từ Liêm",20.9958654,105.7533298,nam từ liêm,5
129733,Bưu cục cấp 3 Bưu cục Thương mại điện tử Từ Liêm,"Đường 32, Xã Minh Khai, Quận Nam Từ Liêm",21.04011589,105.7649273,nam từ liêm,12
122801,Hòm thư Công cộng độc lập trường Đại học Thương mại,"Đường Hồ Tùng Mậu, Phường Mai Dịch, Quận Cầu Giấy",21.03807658,105.7737483,cầu giấy,16
129140,Bưu cục cấp 3 Mỹ Đình 2,"Đường Nguyễn Cơ Thạch, Phường Mỹ Đình 2, Quận Nam Từ Liêm",21.04013822,105.7649456,nam từ liêm,20
